{
  "$schema": "../schemas/theme-v1.schema.json",
  "schemaVersion": 1,
  "version": "1.0.0",
  "displayName": "ENFP Pop",
  "codeThemeId": "enfp-pop",
  "category": "其他",
  "description": "高饱和青橙与自由脑暴氛围",
  "author": "Codex Skin",
  "variant": "light",
  "previewImage": "../previews/enfp-pop.png",
  "theme": {
    "accent": "#12bfa5",
    "contrast": 50,
    "fonts": {
      "code": "JetBrainsMono NFM",
      "ui": "\"Microsoft YaHei UI\", \"PingFang SC\", \"Noto Sans SC\", \"Segoe UI\", sans-serif",
      "display": "ui-rounded, \"Arial Rounded MT Bold\", \"Microsoft YaHei UI\", \"Noto Sans SC\", sans-serif"
    },
    "ink": "#202335",
    "opaqueWindows": true,
    "semanticColors": {
      "diffAdded": "#22c55e",
      "diffRemoved": "#ff6a57",
      "skill": "#ffb31a"
    },
    "surface": "#fffaf0",
    "backgroundImage": "../backgrounds/enfp-pop-hero-v2.jpg",
    "logoImage": "../logos/enfp-pop-logo-ui-v1.png",
    "backgroundImageOpacity": 1,
    "backgroundImageBlur": 0
  },
  "home": {
    "brand": "ENFP",
    "eyebrow": "灵感发动机已启动",
    "badge": "今天适合开脑洞",
    "title": "先有灵感，再把它变成真的",
    "subtitle": "脑暴、试错、灵感乱飞，但最后都能落地",
    "tags": [
      "自由探索",
      "创意无限",
      "热情驱动",
      "趣味至上"
    ],
    "sidebarLabels": {
      "newTask": "新建点子",
      "scheduled": "灵感排期",
      "plugins": "插件",
      "settings": "设置"
    },
    "composerHint": "随便输入一个想法吧～ 我陪你一起把它变成酷炫的作品！",
    "footerNote": "今日心情：创意 +100 · 动力 +100 · 乐趣 +100",
    "quickActions": [
      {
        "icon": "✦",
        "title": "灵感脑暴",
        "description": "把脑子里的一万种可能都倒出来",
        "prompt": "和我一起进行灵感脑暴，先自由发散多个方向，再整理成最值得尝试的方案。"
      },
      {
        "icon": "↗",
        "title": "快速原型",
        "description": "想法不等人，先跑起来再说",
        "prompt": "请把这个想法快速做成可运行的原型，优先完成核心体验。"
      },
      {
        "icon": "↻",
        "title": "边玩边改",
        "description": "改到爽为止，体验即正义",
        "prompt": "请和我一起迭代当前功能，根据实际体验边测试边修改。"
      },
      {
        "icon": "!",
        "title": "欢乐修 Bug",
        "description": "把问题拆开，逐个解决",
        "prompt": "请诊断并修复当前 Bug，说明根因并验证修复结果。"
      }
    ]
  },
  "copy": {
    "title": "Codex ENFP 小宇宙",
    "replacePlaceholders": {
      "Ask Codex": "Turn the idea into something real...",
      "Ask Codex anything": "随便输入一个想法吧~ 我陪你一起把它变成酷炫的作品！",
      "向 Codex 询问任何问题": "随便输入一个想法吧~ 我陪你一起把它变成酷炫的作品！",
      "给 Codex 发送消息": "随便输入一个想法吧~ 我陪你一起把它变成酷炫的作品！"
    }
  }
}
