{
  "$schema": "../schemas/theme-v1.schema.json",
  "schemaVersion": 1,
  "version": "1.0.0",
  "displayName": "KUN Stage",
  "codeThemeId": "kun-stage",
  "category": "人物",
  "description": "黑金舞台与聚光灯氛围",
  "author": "Codex Skin",
  "variant": "dark",
  "previewImage": "../previews/kun-stage.png",
  "theme": {
    "accent": "#d5b47c",
    "contrast": 68,
    "fonts": {
      "code": "JetBrainsMono NFM",
      "ui": "\"Microsoft YaHei UI\", \"PingFang SC\", \"Noto Sans SC\", \"Segoe UI\", sans-serif",
      "display": "\"Noto Serif SC\", \"Source Han Serif SC\", STSong, SimSun, Georgia, serif"
    },
    "ink": "#ead8b5",
    "opaqueWindows": true,
    "semanticColors": {
      "diffAdded": "#9bbb74",
      "diffRemoved": "#c8654f",
      "skill": "#d5b47c"
    },
    "surface": "#101211",
    "backgroundImage": "../backgrounds/kun-stage-hero-v2.jpg",
    "logoImage": "../logos/kun-stage-logo-ui-v1.png",
    "backgroundImageOpacity": 1,
    "backgroundImageBlur": 0
  },
  "home": {
    "brand": "KUN",
    "eyebrow": "KUN 专属定制皮肤",
    "badge": "ikun 集美最喜欢",
    "title": "我们一起创造什么？",
    "subtitle": "与 KUN 同频，用代码点亮舞台",
    "tags": [
      "舞台同频",
      "黑胶质感",
      "金色灵感",
      "ikun 应援"
    ],
    "sidebarLabels": {
      "newTask": "新建舞台",
      "scheduled": "已安排",
      "plugins": "插件",
      "settings": "设置"
    },
    "composerHint": "随心输入，让 KUN 陪你一起写代码吧～",
    "footerNote": "Be Better, Be KUN",
    "quickActions": [
      {
        "icon": "</>",
        "title": "探索并理解代码",
        "description": "看清舞台背后的结构",
        "prompt": "请帮我探索并理解当前代码库，先概览结构、关键模块和主要流程。"
      },
      {
        "icon": "+",
        "title": "构建新功能、应用或工具",
        "description": "让新想法正式登台",
        "prompt": "请根据当前项目构建一个新功能，先确认需求并给出可运行的实现。"
      },
      {
        "icon": "✓",
        "title": "审查代码并提出修改建议",
        "description": "检查每个关键细节",
        "prompt": "请审查当前代码，优先查找缺陷、回归风险和缺失测试，并提出修改建议。"
      },
      {
        "icon": "!",
        "title": "修复问题和失败",
        "description": "排除故障，继续演出",
        "prompt": "请诊断当前问题或失败，找到根因、完成修复并验证结果。"
      }
    ]
  },
  "copy": {
    "title": "Codex KUN 舞台",
    "replacePlaceholders": {
      "Ask Codex": "Light up the code...",
      "Ask Codex anything": "随心输入，让 KUN 陪你一起写代码吧~",
      "向 Codex 询问任何问题": "随心输入，让 KUN 陪你一起写代码吧~",
      "给 Codex 发送消息": "随心输入，让 KUN 陪你一起写代码吧~"
    }
  }
}
